code,answer,score_v1,score_v2,score,ideal,score_ideal_ratio
A.1,"YES. The company has developed and published a Board Charter which is periodically reviewed and which sets out the Board responsibility for internal control. The Board Charter covers amongst other things: statement of good governance; governance structure clearly distinguishing the role of the Board and Management, Board appointments procedure and role, responsibilities, powers and practices of the Board.",2,,2,2,1.0
A.2,"YES. The Board Charter clearly distinguishes the role of the Board and Management, and the company documents ensure that the responsibilities of the board are in line with Code requirements. The Board evaluation questionnaire also focuses on areas such as Board Structure and Composition, Board Practices, Procedure of Board Meetings, Accountability and Risk Management, Information and Communication, and Appropriate Boardroom behaviours. The Board is committed to ensuring that the Company is in compliance with the laws, regulations, and standards applicable to it.",2,,2,2,1.0
A.3,"YES. The content indicates that Board members take their responsibility for the corporate governance agenda seriously and have established a Corporate Governance Framework to ensure effective governance across the Group. The Board ensures high standards and practices in Corporate Governance and has established internal procedures and monitoring systems to promote compliance with applicable laws, regulations, and standards. The Group Board has the overall responsibility for good corporate governance across the Group and ensures that the governance policies and mechanisms are appropriate to the structure, business, and risks of the Group. The Board Charter and Code of Conduct and Ethics are publicly published on the Group's website, and the Board evaluation questionnaire focuses on key areas such as Board Structure and Composition, Board Practices, Procedure of Board Meetings, Accountability and Risk Management, Information and Communication, and Appropriate Boardroom behaviors.",2,,2,2,1.0
A.4,"The Board ensures that the Code of Ethics is cascaded down to all Directors and employees, and is factored into the Performance Evaluation. The Board also has established internal procedures and monitoring systems to promote compliance with applicable laws, regulations, and standards. Newly appointed Board members are inducted into their role as soon as possible following their appointment, and Board members have access to continuous development programs on relevant issues and additional business awareness sessions to enable them to maintain, deepen, and update their knowledge and skills to effectively fulfill their responsibilities as Board members. The Board evaluation questionnaire focused on key areas such as Board Structure and Composition, Board Practices, Procedure of Board Meetings, Accountability and Risk Management, Information and Communication, and Appropriate Boardroom behaviors. The Board Charter and Code of Conduct and Ethics are publicly published on the Group's website, and the Annual Workplan and Evaluation tools ensure that the Board activities for the year are well planned and its performance duly assessed respectively.",2,,2,2,1.0
A.5,"YES. The company documents indicate the role of the Board in developing and monitoring the company strategy. The Board provides strategic direction to the company, governance through policy and accountability to all stakeholders, and is cognizant that its oversight role includes risk management oversight and strategy formulation for value creation and to ensure optimal financial performance. Non-Executive Directors are vested with key responsibilities to constructively challenge and contribute to the development of strategy and extend the business of the Group, monitor the performance of management in meeting agreed goals and objectives, and ensure that the financial information is accurate, and that financial controls and systems of risk management are robust and defensible. The Board Charter and Code of Conduct and Ethics are publicly published in the Group’s website while the Annual Workplan and Evaluation tools ensure that the Board activities for the year are well planned and its performance duly assessed respectively. Board members are provided with regular updates on matters relevant to legal reforms, corporate governance, the corporate environment, regulatory obligations, business/commercial risks, and other matters that may be of interest in the execution of their role. The Board evaluation questionnaire focused on key areas such as Board Structure and Composition, Board Practices, Procedure of Board Meetings, Accountability and Risk Management, Information and Communication, and Appropriate Boardroom behaviours. The Board during the period under review commenced an intensive update of the existing and development of new and appropriate Governance documents that define appropriate corporate governance principles that shall provide appropriate incentives for the Group to pursue objectives that are in the best interests of the Group, its Shareholders, and other stakeholders whilst protecting their interests.",2,,2,2,1.0
A.6,"YES. The company strategy promotes sustainability of the company through various initiatives such as considering social and environmental impacts, adopting an Environmental and Social Risk Framework, and adhering to a disciplined process of capital allocation that ensures profitable and sustainable growth markets. The company also actively considers the social and environmental footprint of its activities and is committed to operating sustainably and making a positive contribution beyond its core businesses.",2,,2,2,1.0
A.7,"YES. All board committees are governed by a written charter/terms of reference, disclosing its mandate, authority, duties, composition, leadership and working processes. The Board Charter and Code of Conduct and Ethics publicly published in the Group’s website while the Annual Workplan and Evaluation tools ensure that the Board activities for the year are well planned and its performance duly assessed respectively. The Board has established different Committees with established terms of reference to provide guidance on broad functions of the Group such as audit, risk management, remuneration, finance, strategy & investment as well as governance. The Board ensures that the Committees are appropriately constituted with members who have the necessary skills and expertise to deliver as per the Committee mandates.",2,,2,2,1.0
B.1,"YES. The Board has established a Nomination Committee comprised mainly of independent and non-executive Board members. The Group Board Governance, Nominations and Compensation Committee recommends new nominees for appointment to the Board.",2,,2,2,1.0
B.10,YES. The Group Board assesses the independence of Board members on an annual basis to mitigate the risks arising from conflict of interest or undue influence from interested parties.,2,,2,2,1.0
B.11,NO,0,,0,2,0.0
B.12,"YES. The Board is comprised of a majority of non-executive board members, as stated in multiple excerpts.",2,,2,2,1.0
B.13,"The Board ensures a smooth transition of Board members by inducting newly appointed members into their role as soon as possible, providing access to continuous development programs, and having a Board Succession policy and Plan in place. The Board Appointments Policy and Procedure ensures appointments consider academic qualifications, technical expertise, experience, nationality, age, gender, integrity, and ethical standards. The Board Diversity Policy and Skills Matrix ensures a diverse mix of proficient individuals. The Board assesses the independence of Board members annually and prescribes 70 years as the age limit for Directors. The Group Board has established necessary tools, including a Code of Conduct and Ethics, Board Charter, Annual Board Workplan, and an Evaluation toolkit used for the annual Board Evaluation conducted by an independent consultant.",2,2.0,3,3,1.0
B.14,NO,0,,0,2,0.0
B.15,YES. The functions of the Chairperson and the Chief Executive Officer are exercised by separate individuals.,2,,2,2,1.0
B.16,"YES, the Chairman of the Board is a non-executive board member.",2,,2,2,1.0
B.17,"YES. The Board has established procedures to allow its members access to relevant, accurate and complete information and professional advice. They are provided with regular updates on matters relevant to legal reforms, corporate governance, the corporate environment, regulatory obligations, business/commercial risks, and other matters that may be of interest in the execution of their role. The Board ensures that the Committees are appropriately constituted with members who have the necessary skills and expertise to deliver as per the Committee mandates. The Group is committed to ensuring that newly appointed Board members are inducted into their role as soon as possible following their appointment and that Board members have access to continuous development programmes on relevant issues and additional business awareness sessions to enable them to maintain, deepen and update their knowledge and skills to effectively fulfil their responsibilities as Board.",2,,2,2,1.0
B.18,YES. The Board has adopted a policy on managing conflict of interest.,2,,2,2,1.0
B.19,"YES. The Board has adopted policies on related party transactions and conflict of interest to protect the interests of the company and all its shareholders, which meet the requirements of the Code. The Board ensures high standards and practices in Corporate Governance and adheres to the principles, practices, and recommendations set out under the Code of Corporate Governance for Issuers of Securities in Kenya, as well as the Companies Act, 2015. The Group Board has the overall responsibility for good corporate governance across the Group and ensures that the governance policies and mechanisms are appropriate to the structure, business, and risks of the Group.",2,,2,2,1.0
B.2,"YES, the Chairperson of the Nomination Committee is an independent director.",2,,2,2,1.0
B.20,"YES. The company has appointed a qualified and competent company secretary who is a member in good standing of ICPSK. The company secretary is a Certified Public Secretary (Kenya) and member of The Institute of Certified Public Secretaries of Kenya (ICPSK), and is also assisted by a suitably qualified and competent company secretary.",2,,2,2,1.0
B.21,"YES. The Board has adopted policies and processes to ensure oversight of sustainability, environmental and social risks and issues. The Group has implemented frameworks for considering ESG issues, adopted an Environmental and Social Risk Framework, has a Speak-Up policy, and has established service level agreements at all points of stakeholder engagement. The Board takes into account the interests of key stakeholders and has a Board evaluation questionnaire focused on accountability and risk management. The Group has also defined an Environmental and Social Risk Management policy and considers social and environmental issues to be significant long-term drivers of both financial and non-financial value.",2,,2,2,1.0
B.22,"YES. The Board has developed an annual work-plan to guide its activities, as stated in the content excerpt from Equity-Group-Holdings-PLC-2020-Integrated-Report-and-Financial-Statements.pdf-97-5. The Annual Workplan and Evaluation tools ensure that the Board activities for the year are well planned and its performance duly assessed respectively.",2,,2,2,1.0
B.23,"YES. The Board has undertaken an annual evaluation process and evaluated the performance of the Board, Board Committees, CEO, and company secretary. The evaluation process assesses the effectiveness of the Board and contains recommendations from consultants based on global best practices and legal and regulatory requirements. Following the evaluation exercise led by an independent consultant, the Board deliberates on the evaluation results and subsequently implements the recommendations therein. The 2020 Board Evaluation was conducted, and the results noted for action while the reports were filed with the regulators as required by the regulations within their respective jurisdiction of operation.",2,,2,2,1.0
B.24,"YES. The Equity Group Holdings PLC has established and applied a formal induction program for in-coming members as part of their Board induction and continuous skills development policy. The policy provides a structured process for the induction, identification of Board development needs, and the framework for fulfilling such development needs. The Group also has a Board Appointments Policy and Procedure in place, which ensures the appointment of a diverse and balanced mix of proficient individuals. The Board undertakes an annual assessment of its own performance, the performance of the Chairperson, that of its committees, individual members, the Group Chief Executive Officer & Managing Director, Group Executive Director, and the company secretary.",2,,2,2,1.0
B.25,YES. Board members participate in on-going corporate governance training to the extent of 12 hours per year.,2,,2,2,1.0
B.26,"YES. The Governance, Nominations and Compensation Committee is responsible for recommending remuneration packages for Executive Directors and reviewing general staff remuneration and human resource related practices. The Board has established different Committees, including the Remuneration Committee, to provide guidance on broad functions of the Group such as remuneration. The Remuneration Committee is composed of 7 members, four of whom are Independent Non-Executive Directors, and is responsible for determining the remuneration of directors. Non-Executive Directors do not earn a salary and neither participate in the Group’s bonus schemes nor the Group’s pension plan.",2,,2,2,1.0
B.27,"YES. The Board has established and approved formal and transparent remuneration policies and procedures that attract and retain Board members. The Governance, Nominations and Compensation Committee recommends new nominees for appointment to the Board and recommends remuneration packages offered to its Executive Directors, taking account of the Group’s compensation and risk framework and appraisal structures. The Board also regularly reviews the completeness and effectiveness of the Group’s corporate governance initiatives and policies.",2,,2,2,1.0
B.28,"The Board ensures compliance with all applicable laws, regulations and standards, including the Constitution and internal policies by adhering to the principles, practices and recommendations set out under the Code of Corporate Governance for Issuers of Securities in Kenya, establishing internal procedures and monitoring systems, being supported by qualified legal and compliance professionals, and ensuring that the Company is in compliance with the laws, regulations and standards applicable to it. The Board also updates the Board and Committee charters, ensures governance regulatory compliance, facilitates effective communication between the Company and Shareholders, and monitors share movements on the Register of Shareholders to identify any apparent ‘stake-building’ in the Group’s shares including making appropriate enquiries of Shareholders as to the beneficial ownership of holdings. The Board has established different Committees with established terms of reference to provide guidance on broad functions of the Group such as audit, risk management, remuneration, finance, strategy & investment as well as governance. The Board ensures that the Committees are appropriately constituted with members who have the necessary skills and expertise to deliver as per the Committee mandates. The Group Board has the overall responsibility for good corporate governance across the Group and ensures that the governance policies and mechanisms are appropriate to the structure, business and risks of the Group.",2,2.0,3,3,1.0
B.29,NO,0,,0,2,0.0
B.3,"YES. The Equity Group Holdings PLC has adopted and published procedures for nomination and appointment of new Board members through their Board Appointments Policy and Procedure. The Governance, Nominations and Compensation Committee recommends new nominees for appointment to the Board, taking into consideration the size, diversity, and demographics of the Board to make it effective. The Board Charter also covers the Board appointments procedure and role, responsibilities, powers, and practices of the Board.",2,,2,2,1.0
B.30,NO,0,,0,2,0.0
B.4,"YES. The Board size is adequate for the exercise of the company business, with a minimum of 7 Directors and a maximum of 12 Directors. The Board evaluation process assesses the effectiveness of the board and contains recommendations based on global best practices and legal and regulatory requirements. The Board is cognizant that its oversight role includes risk management oversight and strategy formulation for value creation and to ensure optimal financial performance. The Board provides strategic direction to the company; governance through policy and accountability to all stakeholders. The Board Diversity Policy and Skills Matrix ensure that the Board reflects broad diversity through variation in Directors’ age, gender, professional qualifications, experience as well as nationality. The Board Appointments Policy and Procedure ensures the appointment of a diverse and balanced mix of proficient individuals.",2,,2,2,1.0
B.5,"YES. The Equity Group Holdings PLC has established a Board Diversity Policy and Skills Matrix to ensure diversity in its composition, including age, race, and gender. The Group also has a Board Appointments Policy and Procedure that considers academic qualifications, technical expertise, experience, nationality, age, gender, integrity, and ethical standards. The election/appointment of Board members follows a process that includes nominations received from shareholders, vetting and due diligence by the Executive team, consideration by the Governance, Nomination and Compensation Committee, approval by the Board, and regulatory vetting where required. The Group also has initiatives that drive diversity and inclusion, such as the EQUIP programme that focuses on empowering women staff. The Board assesses the independence of Board members annually and has prescribed 70 years as the age limit for its Directors.",2,,2,2,1.0
B.6,"YES. The Board members represent a mix of skills, experience, business knowledge, and independence to enable the discharge of their duties. The Group has in place a Board Appointments Policy and Procedure that ensures the appointment of a diverse and balanced mix of proficient individuals. The Group Board Governance, Nominations, and Compensation Committee recommends new nominees for appointment to the Board. The Group has established a Board Diversity Policy and Skills Matrix, and the Board as currently constituted reflects broad diversity through variation in Directors’ age, gender, professional qualifications, experience, as well as nationality. The Board effectiveness is judged based on the underlying principles of being composed of the right mix of skills and experience, getting the right information and well-written reports, making the best use of time focusing on the most important matters, having effective processes and strategies, having effective Committees to ensure the correct interface with management teams, having effective leadership that draws out different perspectives, working effectively as a team and respecting different points of views, and working constructively with the Chief Executive and providing constructive challenge in the management team. The Group has prescribed 70 years as the age limit for its Directors. The Group Board assesses the independence of Board members on an annual basis to mitigate the risks arising from conflict of interest or undue influence from interested parties.",2,,2,2,1.0
B.7,NO,0,,0,2,0.0
B.8,NO,0,,0,2,0.0
B.9,YES. Independent directors are at least one-third of the total number of Board members.,2,,2,2,1.0
C.1,"YES. The governance framework recognizes the need to equitably treat all shareholders, including the minority and foreign shareholders. The Board has updated and developed new governance documents that define appropriate corporate governance principles that provide incentives for the Group to pursue objectives that are in the best interests of the Group, its shareholders, and other stakeholders while protecting their interests. The Group Board recognizes that sound corporate governance principles are the foundation upon which stakeholder trust is built. The election/appointment of Board members follows a process that ensures diversity in academic qualifications, technical expertise, relevant banking knowledge, experience, nationality, age, and gender to ensure a balanced Board that fairly reflects the Group's shareholders and other stakeholders and provides a mechanism for the representation of minority shareholders. The Group also discloses relevant information to shareholders and investors to make informed investment decisions and seeks their perspectives on the Group's financial performance and strategy.",2,,2,2,1.0
C.2,"The Board facilitates the effective exercise of shareholders' rights by updating the Board and Committee charters, ensuring governance regulatory compliance, facilitating effective communication between the Company and Shareholders, monitoring share movements on the Register of Shareholders, conducting quarterly investor briefings and one-on-one shareholder meetings/calls, providing timely and transparent disclosure of information to Shareholders, involving Shareholders in approving major strategic and corporate decisions, providing written responses to questions and clarifications received from Shareholders, allowing Shareholders to appoint a proxy to vote on their behalf, ensuring effective corporate governance practices and processes are embedded in the Company, and taking into account the interests of key stakeholders through maintaining open channels of communication and feedback.",2,,2,2,1.0
C.3,"The Board facilitates shareholders participation at the AGM by allowing them to appoint a proxy to vote on their behalf, sending notifications to shareholders domiciled outside Kenya who have registered for the meeting, providing a livestream platform for shareholders to follow the proceedings of the AGM and access the agenda and vote, sending SMS/USSD prompts or email reminders to duly registered shareholders and proxies, allowing shareholders to ask questions in advance of the meeting, and publishing a full list of all questions received and the answers thereto on the Company's website. The Group also conducts quarterly investor briefings and one-on-one shareholder meetings/calls where requested to engage with all shareholders.",2,,2,2,1.0
C.4,NO,0,,0,2,0.0
C.5,"YES. The content provides evidence that the Board proactively provides information to shareholders and the media, in a timely basis, on corporate affairs and corporate governance. The Group has set up an investor relations docket, conducts quarterly investor briefings and one-on-one shareholder meetings/calls, and avails information on the Group's performance through distribution of integrated reports annually and convening investor briefings on a quarterly basis. The Group is committed to timely and transparent disclosure of information to its Shareholders. The Board evaluation questionnaire focused on key areas such as information and communication, and the resultant reports were filed with the regulators where required by the respective jurisdiction of operation regulations. Board members are provided with regular updates on matters relevant to legal reforms, corporate governance, the corporate environment, regulatory obligations, business/commercial risks, and other matters that may be of interest in the execution of their role. The Group complies with all the aspects of the 2015 Capital Markets Authority (CMA) Code of Corporate Governance, and the Group publishes important company information on its website, including financial statements, investor briefings, particulars of shareholding, Group Notices and AGM material, Group Board Charter, Group Corporate Governance Framework, code of ethics, and key Group Policies including the Group Transparency and Disclosure Policy. The Board ensures high standards and practices in Corporate Governance and more specifically the principles, practices, and recommendations set out under the Code of Corporate Governance for Issuers of Securities in Kenya (“the Code”) as well as the Companies Act, 2015 (“the Act”) are adhered to.",2,,2,2,1.0
D.1,"YES. The Board has a stakeholder-inclusive approach in its practice of corporate governance and identifies its various stakeholders. The Board takes into account the interests of key stakeholders through maintaining open channels of communication and feedback, through regular interaction, investor briefings and conference calls and also allocating sufficient time to Shareholders during the AGM to raise points of concern. The Group has developed a Stakeholder Relations Policy as well as Dispute Resolution Policy to guide on how the Group should relate to, and with its Stakeholders, in relation to the creation of jobs, sustainability of the communities in which it operates and ensure that the rights of Stakeholders, whether established by law or custom, are recognised, respected and protected while ensuring a sustainable and financially sound Group. The Group is committed to building mutually beneficial relationships with all its Stakeholders and to ensuring that a balance is maintained between the individual interests of Stakeholders and those of the Group.",2,,2,2,1.0
